<!ELEMENT CarList (SportCars)>
<!ELEMENT SportCars (Car)*>
<!ELEMENT Car (Discription,Model,Price,Location,Insurance?)>
<!ELEMENT Discription (#PCDATA)>
<!ELEMENT Model (Name,HP,FuelConsumption,Seats,Doors,LuggageCapacity)>
<!ELEMENT Price (#PCDATA)>
<!ELEMENT Insurance (EMPTY)>
<!ATTLIST Insurance currency CDATA #FIXED "EUR";
<!ELEMENT Location (#PCDATA)>
<!ELEMENT Name (#PCDATA)>
<!ELEMENT HP (#PCDATA)>
<!ELEMENT FuelConsumption (#PCDATA)>
<!ELEMENT Seats (#PCDATA)>
<!ELEMENT Doors (#PCDATA)>
<!ELEMENT LuggageCapacity (#PCDATA)>
<!ATTLIST LuggageCapacity Amount(liters|bags) #REQUIRED >
<!ATTLIST Price currency(EUR|RUB|GBP|USD) #REQUIRED>

